<?xml version="1.0"?>
<?xml-stylesheet type="text/css"; href="style.css"?>
<BookKatalog xsi:noNamespaceSchemaLocation="struct.xsd" xmlns:xsi="http://www.w3.org/2001/XMLSchema-instance" >
<book>
<name>The village of numbers</name>
<author>Oleg</author>
<ISBN_number>616513</ISBN_number>

<cost>1651</cost>

<summary>No summary</summary>

<image>ihjngksfjddshgkjehfsofsbf</image>

<page_count>646</page_count>

<year_of_production>2021</year_of_production>

<place_of_production>Dgahid2</place_of_production>

<language>English</language>

</book>

</BookKatalog>
